ID,수행 일자,지원 기업명,기업 유형,주업종,기업현황 및 DT이슈,DT 에로사항,교육지원,기타의견,훈련과정명(정답라벨),기업 진단 내용,훈련 직무,내용,목표,AS-IS,To_Be,성과상세,도움정도,교육참여전 평균값,교육참여 후 평균값
2222,2022-08-25,(주)제이앤씨,법인,제조업,"1) 주요 생산품 및 제품 : 차체용접설비, 검사구. 2) 장비 보유 현황 : 가공설비, 와이어설비, 제관설비, 3차원 측정기. 3) 스마트팩토리 도입 현황 : 효율적 생산관리를 위해 MES 도입의 필요성은 인지하고 있으나 기업에 특화된 MES 시스템에 대한 이해가 부족하여 아직 구축하지 못하고 있음.","설비 제작시의 품질, 설비, 물류 관리 등의 업무 전산화 및 이력 관리가 제대로 이루어지지 않아 업무 Loss 및 추가 비용이 발생하고 있고 작업 중 현장에서 도면 지참이 어려워 MES구축을 통한 실시간 사무실과 현장 간 네트워크 시스템구축이 절실하나 MES에 대한 이해가 부족하고 해당 기업에 특화된 MES시스템 구축 사례를 찾기가 힘들어 도입이 미루어지고 있는 상황임.",,"품질 및 설비 관리, 물류 관리 측면에서 공장을 스마트화 함으로써 원가 절감 및 생산성 향상에 대한 필요성은 충분히 공감하고 있으나 이를 위한 스마트공장 계획이나 구축 실무에 대한 경험이 없어 이에 대한 교육 및 정부 지원 등의 욕구가 강함. 향후 이를 감안한 추가 지원의 필요성이 있음.",MES 이해,차제 용접설비 제작시 현장에서 시시각각 변하는 생산 조건 및 도면 확인을 제때 이루어 생산성을 높이고자 생산관리 시스템 구축이 필요하여 교육을 통해 MES 시스템을 이해시키고 구축사례 제시가 필요함,MES 생산관리 시스템의 이해 MES 구축 사례 습득,차제 용접설비 제작시 현장에서 시시각각 변하는 생산 조건 및 도면 확인을 제때 이루어 생산성을 높이고자 생산관리 시스템 구축이 필요하여 교육을 통해 MES 시스템을 이해시키고 구축사례 제시가 필요함,MES를 통한 작업표준 및 공정계획의 신속한 현장 전달을 통한 계획과 생산의 Feedback 체계 구축,생산성 향상을 위해 MES를 구축하고 싶으나 MES의 개념 이해 부족으로 구축 방안 수립에 어려움을 느낌,MES 생산시스템의 개념 이해 및 타사 구축 사례 습득을 통해 회사에 맞는 구축방안 개발,교육 수행 후 회사에 맞는 MES 생산시스템 유형 및 개발 방안 파악 MES의 기본 개념 이해 적정 MES 생산시스템 유형 습득 생산성 향상 및 효율적인 생산관리를 위해 MES 시스템의 구축 필요성을 인지하고 회사에 맞는 적정 MES시스템이 무엇인지 교육을 통해 습득,,3,2.666666667
2223,2022-08-30,(주)온광,법인,제조업,"1) 주요 생산품 및 제품 : 누전차단기(ELCB), 배선차단기(MCCB), IGR 누전차단기, APU(비상전원자동절체기). 2) 스마트팩토리 도입 : ① 리벳팅 자동화공정설비 및 MES사스템 개발(2020). ② 누전차단기용 특성 검사공정 자동화장비 개발(2020). ③ IoT 기술을 적용한 실드라벨 부착을 위한 자동화공정설비 개발(2022). 애로 단위 공정별 자동화 일부 실행.",2020년 스마트공장구축지원사업(고도화)을 통해 MES(POP)시스템을 구축하여 운영하고 있으나 서버 및 자동화설비관리를 위한 전담인력 부족으로 활용도가 낮은 상황임. 전문인력과 시간 및 비용이 들더라도 중장기적 차원에서 현장에서의 활용도를 높이면서 생산효율 및 제조원가를 절감할 수 있는 효율적인 스마트공장 시스템 구축이 필요함. 1) 스마트공장 도입을 위한 자체 인력 배정 및 장비 투자비 여력 없음. 2) 종업원이 현업 과부하로 디지털 전환에 대한 관심을 가지기에는 역부족. 3) 조립공장에서 디지털 전환에 대한 방향에 대해 기술적 정보 부족.,,"중소기업의 문제점으로 IT 전담조직운영 및 전문인력 양성이 현실적으로 어려움. IT 시스템 구축 후, 지속적인 수정 보완이 필요하나 담당자의 역량부족, 비용 등의 이유로 점차 활용도가 낮아짐. 이에 스마트 공장 구축 및 운용을 위한 효율적 스마트공장 구축 및 스마트공장 구축 실무 IT 전담인력 양성을 위한 교육(지원)이 필요함.",4차 산업혁명과 디지털전환,"4차 산업 혁명에 대한 개념적 의미를 갖추고 있으나 환경변화에 대한 능동적 대응방안 및 기업에 무엇이 필요한지, 시급한지 등을 고민하고 있는 상황임. 아울러 디지털 전환에 대한 교육 경험이 없는 상태임.",디지털 전환 훈련과정,"4차 산업 혁명에 대한 개념적 의미를 갖추고 있으나 환경변화에 대한 능동적 대응방안 및 기업에 무엇이 필요한지, 시급한지 등을 고민하고 있는 상황임. 아울러 디지털 전환에 대한 교육 경험이 없는 상태임.",디지털 전환의 필요성에 대한 마인드 고취 및 역량강화로 업무의 효율화,○ 4차 산업 혁명에 대한 개념적 의미 미흡 ○ 환경변화에 대한 능동적 대응방안 미흡 ○ 디지털 전환에 대한 교육 경험 없음,○ 4차 산업 혁명 대비 도입방안 도출 ○ 환경변화에 대한 능동적 대응방안 확보○ 디지털 전환에 대한 교육 경험 있음,"○ 교육수행 후 PLC 자동화설비의 효율적 유지보수 방안 및 신뢰성 평가 방안 확보 - PLC 자동화설비의 주요점검 항목 및 상시 점검방법 획득 - PLC 자동화설비의 내구성 및 신뢰성 평가를 위한 기초데이터 획득 ○ 자동화설비 주요부품 최적설계를 위한 응력해석 수행, 자재 수입검사(샘플링, 전수검사)를 효율적으로 수행하기 위한 실물투영기 100% 활용법 확보",,1.75,3.25
2224,2022-08-31,산전정밀(주),법인,제조업,"1) 주요 생산품 및 제품 ① 산업용 차단기 개폐기 : acb cradle, vcb 대차, power fuse, earthing switch ② 당사의 생산품은 전량 LS일렉트릭에 납품하는 품목으로서, 대부분 산업용으로 사용되는 전력기기용 부품 및 반제품으로 구성되어 있음. (즉 VCB, ACB용 반제품 및 CRADLE, POWER FUSE를 생산). ③ ACB, VCB는 산업용 차단기를 말하는 것으로서 대형건물, 공장, 변전소, 아파트 단지 등에서 배전반 안에 장착하여 사용함. ④ CRADLE : 차단기(VCB, ACB)를 탑재하는 박스형태의 철 구조물이며, 수동핸들 또는 모터를 이용하여 차단기를 수납(인입?출) 하는 구조로 되어 있음.","1) 현재 mes 고도화 구축을 통해서 mes 데이터를 활용하여 생산계획 수립을 진행하고 있으며, 공정별로 키오스크를 투입하여 공정데이터 관리를 수행하고 있음. 2) 스마트 팩토리에 대한 개념 및 이해가 부족하여 직원들의 교육이 필요함.",,"당사는 공정 자동화를 지속적으로 추진하고 있으나, 자동화에 따른 제반 시설 운영에 대한 전반적인 교육이 필요한 실정에 있음.",4차 산업혁명과 디지털전환,"4차 산업혁명에 대한 개념적 의미는 갖추고 있으며, 현장 공장자동화(smart factory) 추진에 있어서 일부 가공공정은 적용하고 있으며, 조립공정에 대해서는 적용 검토를 진행하고 있음.",디지털 전환 훈련과정,"4차 산업혁명에 대한 개념적 의미는 갖추고 있으며, 현장 공장자동화(smart factory) 추진에 있어서 일부 가공공정은 적용하고 있으며, 조립공정에 대해서는 적용 검토를 진행하고 있음.",디지털 전환의 필요성에 대한 마인드 고취 및 역량강화로 업무의 효율화,○ 4차 산업혁명(smart factory) 일부 공정 적용 ○ MES 고도화 준비 중 ○ 디지털 전환에 대한 교육 경험 미흡,○ 4차 산업혁명(smart factory) 주요기술 공정 적용 검토 ○ MES와 공정 data간의 interface 검토 ○ 디지털 전환에 대한 공정 적용 검토,"용접 자동(robot) 작업 시 센서(전류, 전압, 가스유량)로 data 집계 및 작업조건 감지로 이상 확인 : 양품과 불량품 자동 선별가능하며, 불량품은 육안 확인 후 재작업 실시 → 용접작업조건 최적화 방안 모색 - 용접 조건 data 자동으로 집계되고 있으나, 데이터 활용은 미흡함. → 용접품질 모니터링 데이터 : MES Network 공유 방안 제시 FJ29",,3.333333333,4.333333333
2225,2022-08-31,(주)티엔에스,법인,제조업,"1) 주요 생산품 및 제품 : 오일레스 베어링, 금형 기계 부품류. 2) 장비보유 현황 : CNC 선반(턴밀 복합) 5대, CNC 자동드릴 1대, 범용선반 3대, 드릴 (대형, 소형) 5대, NC 밀링 5대, 범용밀링 2대, CNC 조각기 2대, 기타 계측 측정기 30대.",1) 정보에 대한 도입과 기초적인 내용을 알 수 없음. 2) 전문성 있는 외부 교육에 대한 지원정책 등에 도입 정보가 부족함.,,"K-Digital의 교육으로 MES와 생산성 향상, 원가 절감으로 기업의 경쟁력을 향상 시킬 수 있는 계기가 되기를 기원하며 중소기업의 KDT 구축 지원이 되었으면 좋겠습니다.",MES 이해,정보에 대한 도입과 기초적인 내용을 알 수 없음 - 전문성 있는 외부 교육에 대한 지원정책 등의 정보가 부족함,공정관리,정보에 대한 도입과 기초적인 내용을 알 수 없음 - 전문성 있는 외부 교육에 대한 지원정책 등의 정보가 부족함,"MES시스템의 개념 및 구성범위를 이해하고, MES시스템의 출현배경을 숙지함으로써 MES시스템이 추구하는 전략적 목표를 이해할 수 있으며, 기능적 방향을 수립할 수 있다.",제조실행시스템(MES)의 기초적인 내용을 알 수 없음 정보에 대한 교육이 없고 도입의 필요성을 알지 못함 이해와 정보 부족으로 직원 간 공감대가 미흡,K-Digital의 교육으로 MES를 이해하고 기업의 경쟁력을 향상 시킬 수 있는 도입의 필요성과 전 직원 공감대가 형성되었음,"? 제조핵심역량 파악 ?공장운영에 필수적인 운영 역량 및 Engineering으로 구분가능 ? 제조실행시스템의 전략 및 주요과제의 이해 ?제조실행시스템의 추구전략은 제조현장의 LOSS를 발견하고 이를 제거함으로써 부가가치 생산 활동을 지원할 수 있는 시스템 ?제조현장의 LOSS는 생산LOSS , 품질LOSS, 물류LOSS, 관리LOSS를 정의하고 이를 해결하기 위한 다양한 지표를 관리 ?제조실행시스템의 주요핵심 실행 과제는 생산관리영역, 설비관리영역, 품질관리영역, 물류관리영역, 현장관리영역, 시스템영역으로 구분하여 다양한 기능으로 구성 ? 제조실행시스템(MES) 도입의 필요성과 공감대 형성",,4.5,4.5
2226,2022-09-14,유일솔루텍(주),법인,제조업,"1) 주요 생산품 및 제품 : 사출 성형품. 2) 장비보유 현황 : CNC 2대, MILLING MACHINE 2대, Wire Cut 1대, NC방전기 1대, Radial Drilling M/C 1대, 선반 1대, 성형연삭기 2대. 3) 스마트팩토리 도입 현황 : 스마트공장 추진 및 MES SYSTEM 설치 운영 진행 중.","1) 인원 퇴직 및 증원에 따른 전문 기술교육의 필요성이 나타남(특히 품질부서). 2) 다품종 소량생산 및 다기능화가 요구되고 고객사의 품질 요구가 높아짐. 3) 현재 MES 관련 일부 추진하고 있으며 MES 데이터를 활용하여 납기관리, 생산관리 및 재고관리의 기술을 향상 시켜 시스템을 효율적으로 지속, 활용하는 방법과 교육이 필요합니다.",,"중소기업에서 스마트팩토리 추진에 전담조직 또는 담당자의 운영이 어렵고 IT시스템 구축 후, 지속적인 수정 보완이 필요하나 담당자와 전담자의 이직에 따른 역량부족, 비용 등의 이유로 점차 활용도가 낮아지고 있어 지원(투자)에 따른 중소기업의 IT지원 인원의 관리 방법도 검토가 필요합니다.",MES 실무,"디지털 추진에 대한 프로세스 혁신에 대한 교육이 필요함 - 스마트팩토리 도입, 추진 중에 외부 교육에 대한 지원정책 등의 정보가 부족함","MES의 생산, 품질, 설비관리","디지털 추진에 대한 프로세스 혁신에 대한 교육이 필요함 - 스마트팩토리 도입, 추진 중에 외부 교육에 대한 지원정책 등의 정보가 부족함",MES 생산시스템을 통해 공정 흐름에 따른 작업지시 업무를 수립할 수 있다. 품질시스템을 통해 다양한 불량분석 기법과 부적합처리 관리절차 업무를 수립할 수 있다. 설비관리 시스템을 통하여 설비 생산성에 대한 지표를 이해하고 설비정지 Loss에 대한 유형 및 관리 방법에 대한 기술을 확보할 수 있다.,"MES에 대한 팀별 실행교육을 수시로 실시하고 있으나 부서별 업무에 MES의 실행 내용이 미흡함. *부서별 정보에 대한 교육이 없고 도입과 추진에 대한 필요성과 효과성 및 이해와 정보 부족으로 직원의 공감대가 다소 미흡한 실정임 (종전 방식으로 업무처리 기억, 수기 등)",K-Digital의 교육으로 부문별 MES 실행을 이해하고 생산관리를 통한 작업 관리와 공정에서 불량 및 부적합처리 절차를 통해 LOSS를 감소시키고 설비관리를 통하여 기업의 경쟁력을 향상 시킬 수 있는 지속적인 추진과 실행의 필요성에 대한 직원 공감대가 형성되었음,생산 계획수립 ?월간 / 주간단위로 수립 ?대외변수로 인해 잦은 변동이 일어나 계획수립 업무에 어려움이 존재함 ?작업지시수립 ?물류 흐름에 따라 흐름 생산방식 : 라우팅 정보를 토대로 투입지시 수립 ?배치생산방식: BOM 중심의 작업지시 수립 ?작업지시관리 ?온라인 작업지시 체제를 지향 ?작업장 단위의 작업지시 수립 업무를 지원,,4.333333333,4.333333333
2227,2022-09-30,주식회사 정광,법인,제조업,"1) 주요 생산품 및 제품 : 일반형 온도센서, 세라믹 온도센서, 광폭형 온도센서, Thermo-Well, 기타 온도센서, 리드형 온도센서, 산업용 히터, 실리콘 히터, 실리콘라버 히터. 2) 장비보유 현황 :오실로스코프 1대, DC전원공급기 1대, 전압조정기 1대, 디지털멀티메터 1대, 전기안전테스터 1대, 적외선온도측정기 1대, 선반 1대, 용접기 2대, 확대경 1대, 디지털온도측정기 1대, 압착기 1대, 절단기 1대, 센딩기 1대, 작업공구 2Set, 컴퓨터 4대, 프린터 2대. 3) 스마트팩토리 도입 현황 : 현재 제조공정에 스마트팩토리 도입은 안되어 있는 상태임.","1) 디지털 전환에 대한 이해 부족으로 제조 등의 업무에 디지털 전환을 전혀 고려하지 못하고 있음. 2) 소규모 영세 기업이다 보니 디지털 전환을 위한 시설, 장비의 구비가 되지 않은 상태이며 디지털 전환을 위한 기술력, 담당 인력 등 인적 인프라가 미비한 상태임.",,기업 경영자가 4차 산업혁명과 디지털 전환에 대한 지식이 부족하여 어디에서부터 무엇을 시작해야 하는지 엄두를 못내고 있어 체계적이고 지속적이며 현장에 맞는 교육과 자문이 필요함.,4차 산업혁명과 디지털전환,"디지털 전환에 대한 이해 부족으로 제조 등의 업무에 디지털 전환을 전혀 고려하지 못하고 소규모 영세 기업이다 보니 디지털 전환을 위한 시설, 장비의 구비가 되지 않은 상태이며 디지털 전환을 위한 기술력, 담당 인력 등 인적 인프라가 미비한 상태임.",4차 산업혁명과 디지털 전환,"디지털 전환에 대한 이해 부족으로 제조 등의 업무에 디지털 전환을 전혀 고려하지 못하고 소규모 영세 기업이다 보니 디지털 전환을 위한 시설, 장비의 구비가 되지 않은 상태이며 디지털 전환을 위한 기술력, 담당 인력 등 인적 인프라가 미비한 상태임.",4차 산업혁명과 디지털 전환에 대한 이해를 바탕으로 기업에 적용할 수 있는 4차 산업 신기술 정보를 파악,4차 산업혁명과 디지털 전환에 대한 무지로 회사에 적용 가능한 4차 산업 신기술을 알지 못함.,"4차 산업 신기술을 이해를 바탕으로 회사에 적용 가능한 신기술이 무엇이 있는지 고민하고, 이 기술을 이용한 디지털 전환 시도를 연구할 수 있는 능력을 갖춤.","4차 산업혁명과 이에 해당하는 신기술들을 이해하고 이러한 신기술을 회사의 제조공정 혹은 생산관리, 품질관리, 설비관리, 물류관리 등에 어떻게 적용시킬지 토론하고 연구 단순하게 생산자료 수집에서 끝나는 것이 아니라 이러한 생산 데이터를 분석(Big Data 활용)하여 불량률을 저하시키거나 품질을 향상시킬 수 있는 방안을 모색 MES 적용을 고려",,5,5
2228,2022-09-08,(주)에스앤디이엔지,법인,제조업,스마트 팩토리 도입 추진은 미정 단계임.,"1) CAD 도면을 기반으로 CNC선반으로 알루미늄 케이스 가공 시 chip에 의한 표면 불량 등으로 생산성 저하 발생이 되어 이를 해결하고자 가공에서 생성되는 모든 데이터를 수집 및 활용을 통하여 CPS 기반의 자율생산 체계 구축을 하고 싶으나 알지도 못하고 경험도 없어 진행을 못하고 있음. 2) 이에 설비의 유지관리 방법과 설비 예방보전활동 등에 대한 운영방법과 프로세스, 현재의 경험적 관리에서 벗어날 수 있는 효과적인 문제해결 프로세스를 구축할 수 있는 새로운 방식의 전환이 필요함. 3) 이와 같은 문제점 등으로 DT에 대한 필요성에 대하여 인식은 하고 있으나 이번 기회에 교육을 통하여 디지털 역량 강화를 취득하고 싶음.",,"4차 산업혁명 기술 발전으로 경제·사회 전반의 디지털 전환(Digital Transformation) 속도가 빨라지고 있고 가속화되어 가고 있으나, 디지털 산업 혁신역량 제고를 위한 관련 R&D 투자 및 인력 수급에 많은 어려움이 있어 정부, 지자체, 유관기관이 인재를 확보하여 중소기업에 대한 인적·물적 인프라 구축에 관심과 지원 요청.",제조실행시스템운영을통한데이터운영및설비의생산성향상,"CAD도면을 기계 가공을 하기 위하여 CAM 데이터로 변환을 하고 이를 CNC 머시닝 가공기계를 통하여 알루미늄 케이스 가공을 하는 업체로 전체 제조공정이 설비를 통해서 이루어지고 있어 각 설비에 생성되는 가공 데이터 수집 및 공유, CNC 설비의 유지관리와 연계된 MES 도입 및 구축과 생산성 향상을 위한 설비의 예지보전활동에 대한 교육이 필요",? 제조실행시스템(MES) 구축 방안 및 데이터 수집 ? 설비의 최적화 가공 조건 및 고장 방지를 위한 예방보전 방법 지원,"CAD도면을 기계 가공을 하기 위하여 CAM 데이터로 변환을 하고 이를 CNC 머시닝 가공기계를 통하여 알루미늄 케이스 가공을 하는 업체로 전체 제조공정이 설비를 통해서 이루어지고 있어 각 설비에 생성되는 가공 데이터 수집 및 공유, CNC 설비의 유지관리와 연계된 MES 도입 및 구축과 생산성 향상을 위한 설비의 예지보전활동에 대한 교육이 필요",? 제조실행시스템(MES)의 구축과 제조현장 데이터 수집 및 설비관리 교육을 통해 생산성 향상 및 설비보전 업무를 수행할 수 있다.,수작업에 의한 데이터 작성 및 수집으로 인한 정보 오류 및 설비의 잦은 트러블 및 사후 수리 방식의 시스템으로 생산성 저하 CNC 머신 설비의 정보 관리가 수작업에 의한 수집 활동을 하고 있어 설비 상태를 실시간으로 감시할 수 없는 구조임 CNC 머신에서 자주 발생하는 고장 및 원인 분석 어려움이 있어 적기 대응 어려움 설비 예지보전에 실행해야 하는 많은 데이터 수집이 필요하나 최신 기술 도입 부족 설비가공이 주 공정으로 설비 예지보전 활동을 통한 고장 방지 및 적기 대응으로 생산성 확보를 하기 위한 방법론 부재,MES 기반의 가공 데이터 작성 및 수집으로 인한 실시간 정보가 가능해져 사전 예방 보전을 통한 설비관리가 가능하여 이를 통한 생산성 향상 및 품질개선의 방향 제시 CNC 머신 설비의 과부하나 공급 상태 등의 유지 상태를 파악할 수 있어 문제 발생을 예방 CNC 설비의 가공 데이터의 분석을 통한 고장의 원인 파악이 가능해져 적기 대응 가능 설비 예지보전 시 엣지 컴퓨팅 기술을 이용하여 처리 속도를 높이고 비용을 절감하고 보안을 향상시키는 효율적인 시스템을 구성 설비의 가동 중에도 센서의 정보를 통한 문제발생을 즉시 알 수 있어 즉각적인 조치가 가능하여 고장으로 인한 설비 가동률 저하를 방지할 수 있다,"교육수행 후 제조실행시스템의 도입방안과 구축 방법론기반의 설비 데이터 수집 방법 , MES 및 핵심실행과제설비관리편에 대한 이론적 교육 습득( ) . 머시닝 설비에 대한 - CNC 기반의 변환을 통해 구축 방법과 도입 방법 제시와 가공데이터의 수MES 집 활동 변화설비관리 및 보전기법 습득을 통한 사전 예방보전에 의한 설비 관리유지 체제로 전환할 , 경우 생산성 향상 및 품질개선 기대효과 제시.",,3.166666667,4.833333333
