ID,수행 일자,지원 기업명,기업 유형,주업종,기업현황 및 DT이슈,DT 에로사항,교육지원,기타의견,훈련과정명(정답라벨),기업 진단 내용,훈련 직무,내용,목표,AS-IS,To_Be,성과상세,도움정도,교육참여전 평균값,교육참여 후 평균값
2323,2023-12-11,(주)맥파이온,법인,제조업,컨설팅 수행일지 참조,"1. 스마트 팩토리 구축에 대한 기본적인 방법과 지식, 기술이 부족함 2. 회사의 부문별 MES에 대한 기초와 기본적인 사항의 파악이 미흡함",,차후 스마트 관련된 팩토리 구축과 MES에 대한 이해가 부족하며 고객의 품질 요구사항이 점점 높아지고 신기술을 확보하기 위해 생산품과 전부서의 MES 적용의 교육 등관리가 필요함,스마트 Factory 구축방법과 MES 이해,1. 스마트 팩토리 구축방법에 대한 기본적인 내용이 부족함 2. 데이터 수집방법에 대한 솔루션이 미흡함,스마트 팩토리 구축 및 도입을 위한 기본교육 MES의 내용에 대한 기본적 이해,1. 스마트 팩토리 구축방법에 대한 기본적인 내용이 부족함 2. 데이터 수집방법에 대한 솔루션이 미흡함,"1.스마트 관련된 팩토리 구축에 대한 방법을 이해하고 실행할 수 있는 기본적인 내용을 파악할 수 있다. 2.MES시스템의 개념 및 구성범위를 이해하고, MES시스템의 출현 배경을 숙지함으로써 MES시스템이 추구하는 목표를 이해할 수 있으며, 기능적 방향을 수립할 수 있다.",Smart Factory 단계 및 흐름 과정의 내용과 진단 Check List 작성 등 Tool 활용방법의 내용 이해가 부족함 Smart Factory 구축 단계의 요약 파악이 없으며 수준 진단 및 To-Be 설정의 주요단계에 대한 검토가 매우 부족함 생산과 생산관리의 작업은 기존 방식으로 활용하고 있으며 MES 시스템의 부가가치 활동에 대하여 이해가 부족함. 제조시스템 실행에 대한 내용은 파악하고 있으나 MES시스템의 구축전략에 대한 내용의 이해가 부족함,Smart Factory 단계 및 흐름 과정의 내용을 이해하였으며 진단 Check List와 Tool 활용 방법을 파악하고 절차에 따라 활용할 수 있음. Smart Factory 구축 단계의 요약 내용을 파악하고 수준 진단 및 To-Be 설정의 사례를 활용하여 주요단계의 검토를 수행할 수 있음. 생산관리의 작업에 대한 부문별 MES 시스템의 활동에 대하여 일부 이해하고 해당 부가가치의 내용을 파악할 수 있음. 제조시스템 실행에 대한 부문별 내용을 파악하고 MES시스템의 구축전략의 Loss를 구분하여 주요 관리 항목을 선정할 수 있다.,. 스마트 팩토리 구축 방법 - Smart Factory 단계 및 과정 - 진단 Check List 및 Tool 활용방법 - Smart Factory 구축 단계의 요약 - 수준 진단 및 To-Be 설정의 주요단계 2. MES의 내용에 대한 기본적 이해 - 생산과 생산관리 - 시스템의 부가가치 활동 - 제조시스템 실행 - MES시스템의 구축전략,,,
2324,2023-11-01,청학에프엔씨(주),법인,식품가공,"1)주요 생산품 및 제품 : 참기름, 볶음 참깨, 볶음 흑임자 2)주요 공정 : 원료 석발기, 원료 세척기, 저장탱크, 갈음기, 볶음기, 착유기, 충전기, 포장기 3)스마트 팩토리 도입현황 : 2025년 스마트 팩토리 도입 검토중","1) 청학에프엔씨는 오랜기간 식품가공회사로서 기업을 운영함에도 불구하고, 식품가공의 생산라인을 가동하는데 사람의 손을 거쳐야 하는 공정과정으로 인하여, 비용은 높고 생산효율은 떨어지는 경영구조를 가지고 있다. 2) 이러한 구조를 극복하는 방법으로 디지털화를 통한 자동화 생산라인을 구축하고자 도입을 서두르고 있다. 3) 식품가공 업종이라 원물의 재고보유 일수도 점검해야하고, 현장의 직원들도 연령층이 높아 재고점검 및 원물에 대한 관리에 계속 어려움을 호소하고 있다. 4) MES 기초과정에 대한 교육훈련을 통해서, 재고관리 시스템 운영방법을 개선해야만 원가뿐만 아니라, 생산에 대한 운영방법이 개선하고자 한다. 5) 기업에서 DT(Digital Transformation)에 대한 인지도는 있지만, 현장에서 적용하는 방법을 잘 알지 못하며, 현장 적용에 대한 가이드라인을 받지 못하고 있음.",,,MES 기초,"참기름과 흑임자식용유를 제조 판매하는 식품가공회사로 계열사를 4개를 운영하고 있는 식품가공 전문 기업임. -기업의 업력은 오래되었지만, 노동집약적인 생산구조로 인하여, 자동화설비가 진행되지 못하여 고비용- 저효율의 생산구조를 가지고 있어 기업이 적자를 기록하고 있다. -이러한 부분을 극복하고자 DT 교육훈련을 통하여 MES 정착을 위해 시스템 적극적으로 검토하는 단계임. -2023 한국공학대를 통하여 S-OJT를 수행하면서 직업능력개발 훈련에 참여하였으며, 교육훈련의 성과를 도출하게 되었음. - 이번 MES기초과정에 대한 교육훈련을 통해 MES시스템핵심 실행과제중에서 생산관리, 품질관리, 설비관리분야에 대한 명확한 이해를 하는 것이 목표임.","MES시스템 핵심실행과제 생산관리, 품질관리","참기름과 흑임자식용유를 제조 판매하는 식품가공회사로 계열사를 4개를 운영하고 있는 식품가공 전문 기업임. -기업의 업력은 오래되었지만, 노동집약적인 생산구조로 인하여, 자동화설비가 진행되지 못하여 고비용- 저효율의 생산구조를 가지고 있어 기업이 적자를 기록하고 있다. -이러한 부분을 극복하고자 DT 교육훈련을 통하여 MES 정착을 위해 시스템 적극적으로 검토하는 단계임. -2023 한국공학대를 통하여 S-OJT를 수행하면서 직업능력개발 훈련에 참여하였으며, 교육훈련의 성과를 도출하게 되었음. - 이번 MES기초과정에 대한 교육훈련을 통해 MES시스템핵심 실행과제중에서 생산관리, 품질관리, 설비관리분야에 대한 명확한 이해를 하는 것이 목표임.","MES에 대한 기본 개념을 이해하고, 청학에프엔씨의 제조 실행 시스템 응용","청학에프엔씨의 식품가공(참기름, 흑임자유)생산 과정이 고비용-저효율 구조를 변경하고자 함. ?스마트팩토리를 생산라인에 적용시 어떤 장단점이 있는지 K-Digital을 통해 교육-훈련을 받고, 운영방법을 습득 하고자함. ? 청학에프엔씨의 참기름 생산라인에서 MES 시스템에 대한 지식이 부족하여 관리자를 대상으로 교육훈련을 우선 실시하기로 함. ? 현재 참기름 생산라인에서 현장에 투입 되는 직원이 아닌, 생산계획 및 관리 파트에서의 업무자 중심으로 교육",MES 기초과정을 통해서 참기름 생산라인의 효율화를 목표로 함. ? 고비용-저효율 구조를 개선하고자 함. ? 참기름 생산라인 관리자에게 MES기초 과정에 대한 교육훈련을 통해서 청학에프엔씨의 문제점을 찾을 수 있도 록 목표를 부여함. ? 스마트팩토리 기초과정중에서 MES 시스템 핵심 실행과제를 수행할 수 있도록 기초를 마련하고자 함. ? 최종적으로 MES시스템 구축전략을 수행하는데 목표를 두고자함.,,,,
2325,2023-12-04,해솔협동조합,법인,"빵,과자류","1)주요 생산품 및 제품 : 빵, 제빵류 2)주요 공정 : 1. 원료계량, 투입 2. 원료 반죽, 성형 3. 빵 가열, 굽기 4. 제품 포장 5. 금속검출, 보관 3)스마트 팩토리 도입현황 : 2024년에 초기 수준의 스마트 팩토리 도입 준비 중","1) 해솔협동조합은 소규모 제빵제과를 만드는 식품가공회사로서, 의정부시에서 마을기업으로 운영되는 기업임. 2) 소규모 HACCP을 인증 받아 제빵을 만들어 판매금을 사회에 환원하고 있어 수익구조는 좋지 않은 실황이다. 3) 아직 제빵을 만드는 기술이 부족하여, 전문가를 통한 기술전수가 이루어 지고 있으며, 이러한 과정을 거치고 난뒤 DT중에서 제빵에 대한 시간조절, 반죽조절등 초기 빵재료손질에 대한 애로사항을 겪고 있는 과정이다. 4) 디지털화를 통한 제빵과 제과에 대한 자동화 생산라인을 구축하고자 소규모 스마트 공장 도입을 준비하고 있으며, 도움을 요청하고 있다. 5) MES 기초과정에 대한 교육훈련을 통해서, 제빵조리관리 시스템 운영방법을 도입해야만 제조원가뿐만 아니라, 생산 운영 방법을 개선하고자 한다. 6) 기업에서 DT(Digital Transformation)에 대한 인지도는 있지만, 현장에서 적용하는 방법을 잘 알지 못하며, 현장 적용에 대한 가이드라인을 받지 못하고 있음.",,,MES 기초,"사회공헌과 어려운 이웃에 대한 지원으로, 기업의 경영실적은 현상을 유지하는 정도로만 운영되고 있으며, 김미남 CEO는 이타심을 가지고 기업문화를 정착하고, 이익은 사회에 환원하는 것이 기업 운영의 비전이라고 한다. -기업의 운영은 오래되었지만, 소규모의 작은 기업이며, 노동 집약 적인 생산구조로 인하여, 자동화설비가 진행되지 못하여 고비용- 저효율의 생산구조를 가지고 있다. -이러한 부분을 극복하고자 DT 교육훈련을 통하여 MES 정착을 위해 시스템 적극적으로 검토하는 단계임. - 이번 MES기초과정에 대한 교육훈련을 통해 MES시스템 기초 부분에 대한 관리(재고관리, 제조관리, 공정관리, 품질관리)분야에 대한 명확한 이해를 하는 것이 목표임.","MES시스템 핵심실행과제 생산관리, 품질관리","사회공헌과 어려운 이웃에 대한 지원으로, 기업의 경영실적은 현상을 유지하는 정도로만 운영되고 있으며, 김미남 CEO는 이타심을 가지고 기업문화를 정착하고, 이익은 사회에 환원하는 것이 기업 운영의 비전이라고 한다. -기업의 운영은 오래되었지만, 소규모의 작은 기업이며, 노동 집약 적인 생산구조로 인하여, 자동화설비가 진행되지 못하여 고비용- 저효율의 생산구조를 가지고 있다. -이러한 부분을 극복하고자 DT 교육훈련을 통하여 MES 정착을 위해 시스템 적극적으로 검토하는 단계임. - 이번 MES기초과정에 대한 교육훈련을 통해 MES시스템 기초 부분에 대한 관리(재고관리, 제조관리, 공정관리, 품질관리)분야에 대한 명확한 이해를 하는 것이 목표임.","MES에 대한 기본 개념을 이해하고,제조 실행 시스템 응용","해솔협동조합의 제빵 제품생산 과정이 고비용-저효율 구조를 변경하고자 함. ?스마트팩토리를 생산라인에 적용시 어떤 장단점이 있는지 DT교육을 통해 교육-훈련을 받고, 운영방법을 습득 하고자함. ? 해솔협동조합의 제빵 생산라인에서 MES 시스템에 대한 지식이 부족하여 생산라인관리자를 대상으로 교육훈련을 우선적으로 실시하기로 함. ? 생산라인에서 현장에 투입되는 직원의 시간관리를 하면서 생산계획 및 관리 파트에서의 업무자 중심으로 교육 실시.",MES 기초과정을 통해서 생산라인의 효율화를 목표로 함. ? 고비용-저효율 구조를 개선하고자 함. ? 생산라인 관리자에게 MES기초 과정에 대한 교육훈련을 통해서 해솔협동조합의 문제점을 찾을 수 있도 록 목표를 부여함. ? 스마트팩토리 기초과정중에서 MES 시스템 기초과정을 수행할 수 있도록 기초를 마련하고자 함. ? 최종적으로 MES시스템 구축전략을 수행하는데 목표를 두고자함.,보고서 내용X,,,
2326,2023-11-07,(주)성령,법인,알루미늄 비철금속 다이캐스팅,"1. 연혁 및 일반현황 ㅇ.1992 : 성영다이케스팅 창업 ㅇ.2001 : 성령 법인회사 전환 ㅇ.2005 : 품질경영 진증서 취득 ㅇ.2014 : 자회사 SR TECH 설립 및 공장 증축 2. 조직도 및 직무체계(부서 업무 내용, 인적 자원 현황) ㅇ.관리부, 생산부, 가공부, 금형제작 3. 주요 생산품 및 제품 ㅇ.가스미터기, 통신장비, 밸브 등 4. 주요 공정(업무) 및 장비 보유 현황 / 스마트팩토리 도입 현황 ㅇ.제조공정도 ㅇ.장비 보유현황 -.다이캐스팅 콜드참바 : 4대 -.다이캐스팅 핫참바 : 1대 -.사상 및 가공 : 선반, 밀링, 연마기, 벤치레스 외 총 22대","1.원자재 입.출고에서 제품출하 까지 단계별 정보가 수작업에 의존하여 정확하고 신속한 정보공유가 안되어 MES 구축 검토 2.설비자동화는 데이터 수집, 분석, 활용 및 모니터링 기능이 구현되는 정보 시스템’과 연계될 수 있는 현장관리가 필요 3.설비별 자동화 및 시스템연계로 데이터 수집, 활용으로 설비효율화, 생산성 향상 추진 검토 4.다이캐스팅, 밀링 외 자체 제작한 다축가공기 정보와 MES 연계기능이 필요 5.공급기업과 ERP관련 내용을 협의하였으나 업종(다이캐스팅 주고) 특화 절차 및 시스템 구축 유 경험 업체 발굴이 필요 (현재 상용 ERP용으로 재무, 재무, 원자재/제품 입출고..) 6.솔루션 지원 : 당사에 특화된 ERP & MES 통합 솔루션 및 모듈지원 체계가 필요함",,"1. 다이캐스팅 작업공정의 스마트 제조화를 위하여 생산 및 품질데이터 관련 설비생성 정보의 정확도와 수집방법의 운영기준 정립이 우선되어야함 2. 현재 스마트공장은 Level 1 수준으로 스마트공장 구축을 하기 전에 충분에 현장의 운영방안 및 데이터의 수집방안 기준정립이 필요 3. 정보시스템 분야는 모델별 작업진행 수준 및 부분적인 자동화 적용으로 데이터 수집, 분석을 활용할 수 있는 MES 시스템구축의 우선 검토 4. 공정과 업종의 특성상 운영조건 (온도, 습도, 시간..)의 산포로 인한 공정품질의 변동발생이 우려되어 IoT, AI기반의 설비운영 표준화 및 스마트 센싱으로 데이터 수집과 활용방안 수립이 필요 5. 설비자동화는 가동율 향상을 위한 설비운영 및 품질에 영향을 주는 제조현장의 PI 개선활동으로 제조현장의 시스템과 연계 활동 6. 사업장 이전 (‘24년)예정으로 현재 충분한 사전검토와 문제점 개선후 스마트공장 구축 검토가 필요하다고 사료됨",K-플랫폼컨설팅및훈련교육,스마트공장 구축을 위한 사전 문제점 및 개선방안,"스마트공장 수준확인, 제조역량 파악",스마트공장 구축을 위한 사전 문제점 및 개선방안,스마트공장 구축을 위한 사전준비 사항 확인 및 현안 문제점 제시,,,,,4.333333333,4.833333333
2327,2023-11-10,(주)에프엠솔루션,법인,전기용 기계장비 관련 제품,"1. 연혁 및 일반현황 *.사업분야 : 공장자동화 & 메카트로닉스시스템 솔루션 *.주요연혁 -.2012 : 에프엠솔루션 설립 -.2014 : 에프엠솔루션 법인 전환 -.2015 : 2차전지 전/후공정 연구개발 실험장비 개발 -.2021 : 자동화 연구개발 전담부서 설립 -.2022 : 지멘스 인더스트리 소프트웨어 대리점 등록 2. 조직도 및 직무체계(부서 업무 내용, 인적 자원 현황) *.재무, 경영 : 1명 *.생산팀 (제작/구매/납품/사후관리) : 3명 *.소프트웨어팀 (기획/납품/사후관리/프로그램) : 2명 3. 주요 생산품 및 제품 *.2차 전지 연구·실험/교육훈련 제품, 2차 전지 관련 부품생산 시스템 4. 주요 공정(업무) 및 장비 보유 현황 / 스마트팩토리 도입 현황 *.개발 단계의 공정 검토 및 시스템 지원단계로 ‘24년도 장비 구축 예정","1.제조생산 설비제작 업체로써 2차 전지 니켈 BAR 생산을 위한 제조 및 솔루 션 인프라 구축을 위한 사전 준비중임 2.관리되는 제반데이터 (실적, 품질, 납기..)는 수작업 형태의 작업구성으로 데 이터의 수기작성으로 의사결정시 정확도가 미비하여 지연 현상이 발생됨 3.‘24년도 설비(니켈 BAR) 구축시 적정사이즈 구분, 절단 공정까지 실적관리 운영 시스템 구축 및 관련 기술개발과 연계방안 검토, 구축 예정 4.솔루션 개발은 당사에 특화된 간이 MES 솔루션 및 모듈지원 체계가 필요함 5.스마트공장 수준확인을 위한 제조 및 시스템 인프라 구축",,"1. 당사는 기업체에 자동화 및 시스템 솔루션을 공급하는 연구개발과 실험장비 개발에 주력하는 업체로서 제조현장의 운영관리 및 구축시스템은 ‘24년도에 준비하는 단계이며 스마트 제조화를 위한 관련 모듈 구성과 정보 수집방법의 기준정립의 우선 검토가 필요함. 2. 현재 스마트공장은 Level 0 수준으로 운영시스템이 없으며 프로세스 업무의 정례화도 미비한 수준으로 사료되어 스마트공장 구축단계 보다는 현장관리의 인프라 구축과 생산, 품질, 납기 등 주요지표 운영방안 검토 및 실행이 중요함. 3. 정보시스템 분야는 모델별 작업진행 수준 및 부분적인 자동화 적용으로 데이터 수집, 분석을 활용할 수 있는 MES 시스템구축의 우선 검토 4. 설비자동화는 가동율 향상을 위한 설비운영 및 품질에 영향을 주는 제조현장의 PI 개선활동으로 제조현장의 시스템과 연계 활동 5. 사업장내 메카트로닉스 시스템 솔루션과 연계되는 설비가동을 위한 충분한 사전 문제점 개선으로 스마트공장 구축을 위한 사전 검토가 필요하다고 여김.",K-플랫폼컨설팅및훈련교육,스마트공장 구축을 위한 현수준 파악 및 사전 준비사항,"스마트공장 수준확인, 제조역량 파악",스마트공장 구축을 위한 현수준 파악 및 사전 준비사항,스마트공장 구축을 위한 사전준비 사항 확인 및 현안 문제점 제시,,,,,4.777777778,4.777777778
2328,2023-04-18,동해산업(주),법인,제조업,"1) 주요 생산품 및 제품 : BRKT류, TRANSMISSION MOUNTS, SUSPENSION 등. 2) 장비 보유 현황 : Press, Co.2 Welding rovot, CMT welding machine 13대, Spot welding machine 25대, 절삭가공기 7대, Catia 1대, Autocad 1대, 시험기, 측정기, 동력, Hoist, Air compressor. 3) 스마트공장 도입 현황 : 2016년 생산현장 디지털화 지원 사업으로 구축했으나, 구축된 시스템의 결함으로 적용 과정 시 필요한 개선이 어렵고, 전자기기 활용 및 무선인터넷 환경 불안정으로 현장 운영이 불합리하고, 시스템 운영에 필요한 교육, 업무 개선 등 관련된 추가 업무가 많고 복잡하여 현재는 사용안함.",현장의 생산설비(금형/용접) 현황을 실시간 모니터링 할 수 있는 시스템 검토 필요. 1) 누적 타발수 관리 미흡으로 금형 파손 등의 내구성 저하로 손실비용 증가. 2) 금형 세척 주기 관리 미흡으로 이물질에 의한 부품 불량 다발. 3) 용접 조건(전류/전압/가압력/용접시간 등)의 수동관리로 불량률 증가. 4) 용접 점 누락 및 불량 추적 난이.,,"기 구축된 시스템에 대한 이해를 위해서는 체계적인 MES에 대한 교육이 필요하고, 현재 생산성 저하 및 불량 등의 이슈 되고 있는 금형 및 용접 공정의 실시간 관리를 위해서는 데이터의 종류 및 수집 방법에 대한 구체적인 교육이 필요함.",스마트공장 MES이해,"금형 누적 타발수 관리 미흡으로 금형 파손 등의 내구성 저하로 손실비용 증가, 금형 세척 주기 관리 미흡으로 이물질에 의한 부품 불량 다발, 용접 조건(전류/전압/가압력/용접시간 등)의 수동관리로 불량률 증가, 용접 점 누락 및 불량 추적 난이로 인한 생산성 저하 및 불량률 상승에 의한 제조경쟁력 저하",MES 금형관리 시스템 이해 MES 용접관리 시스템 이해,"금형 누적 타발수 관리 미흡으로 금형 파손 등의 내구성 저하로 손실비용 증가, 금형 세척 주기 관리 미흡으로 이물질에 의한 부품 불량 다발, 용접 조건(전류/전압/가압력/용접시간 등)의 수동관리로 불량률 증가, 용접 점 누락 및 불량 추적 난이로 인한 생산성 저하 및 불량률 상승에 의한 제조경쟁력 저하",스마트공장 MES 이해 및 금형·용접 관리 시스템의 교육 및 적용 사례를 통한 관리항목 및 관리방법의 구체화로 생산성 향상 및 불량률 개선 기대,"기 구축된 시스템에 대한 이해를 위해서는 체계적인 MES에 대한 교육이 필요하고, 현재 생산성 저하 및 불량 등의 이슈 되고 있는 금형 및 용접 공정의 실시간 관리를 위해서는 데이터의 종류 및 수집 방법에 대한 구체적인 교육이 필요",체계적인 교육을 통한 제조실행시스템(MES)에 대한 이해도향상 시스템 관리 용이 생산성 및 품질 개선을 위한 금형관리 항목 설정 및 실시간 용접조건관리 항목 설정 등의 시스템 구축 방안 정립 자동차부품 MES 적용 사례를 통한 맞춤형 시스템 구축 가능,"1)체계적인 제조실행시스템(MES)의 교육을 통한 이해도 향상 2)금형 및 용접공정의 실시간 관리를 위한 시스템 관리항목 정립 -타발수, 세척주기, 수리내역, 용접조건(전류/전압/용접시간/가스량/용접(장)점수 등등) 3)동종업계의 MES 적용 사례 공유를 통한 맞춤형 시스템 구축",,1.333333333,4.166666667
2331,2023-08-22,(주)무늬팩토리,법인,제조,"1.21.2월 창업. 2.다년간 쌓았던 PU(POLY URETHAN) 기술적 KNOW-HOW로 PU를 활용한 MEMORY FOAM, 단열재, 기타 관련 제품을 생산","1. 지역적 한계, 중소기업으로 한계로 고급 및 전문니력이 부족하여 자체적인 DT는 어려우며 금번과 같이 전문인력이 투입되어 리드하며 추진을 해야함. 2. 하지만 중소기업의 자금력,인력의 한계로 추진에 많은 애로가 예상되나 대표이사나 직원들이 변화와 성정 그리고 DT도입의지가 중요함, 현재 당사는 자금과 판로에 어려움이 있어 당장 추진에는 애로 사항이 있음.",,1. 현실적인 어려운부분을 정책적으로 어떻게 지원해줄것이냐가 난제이나 기업이 변화 의지가 도입의지가 강하여 지속적인 관리가 필요함 2. 24년 상반기 정부나 지자체 지원사업 연계하여 지원해줌이 좋을 것으로 사료됨,MES 기초,회사업무가 현재 수작업 위주의 업무로 4차산업시대 DX전환과 스마트공장 도입을 목표로 개념 이해 및 향후 도입방안 연구,DX개념이해 및 스마트공장 도입 준비,회사업무가 현재 수작업 위주의 업무로 4차산업시대 DX전환과 스마트공장 도입을 목표로 개념 이해 및 향후 도입방안 연구,스마트공장 도입 실무 이해 및 추진전략 이해,1. 현실점검 (4차산업시대 DX관련) 없어 현실의 어려움민 토로 2.판로개척등 현실적인 어려움을 어떻게 타개할까 막막함,1. DX 현실점검 결과 향후 전환 및 스마트공장 도입을 통한 한단계 점프 계기 2. 인력부족등 타개책 정보화 지능화 3.미래비전 제시로 전직원 한마음 결집,DX 실제 스마트공장 구축이전 단계이며 전략이 부재하여 실제 사례 위주로 교육함 (설문조사시 평가함 점수로 정량적 평가 가능함),,4.333333333,4.666666667
